Role,Description,Alignment,Difficulty
Artist,"Privately, during the day, you may return home to ask the storyteller any one yes or no question",Town,
Fool,"First time you die, don’t",Town,
Drunk,"You think you are a specific town role that is not in play, but your ability doesn’t work",Outsider,
Poisoner,"Nightly, poison 1 player until the next night begins",Minion,
Prisdelo,"Nightly, choose 3 living players. Each is informed that they have been selected. Each must individually choose whether to live or die. If all choose to live, all die",Demon,*
